{"authorization":{"branch":"codex/m4-cross-engineering-forward-evaluation-m4.2-one-shot-authorization","claim_consumes_entire_authorization":true,"closure_head":"88410ce0ee640645aa44e1ba1289789532fd647a","closure_tree":"77925b9a3df09d03f9ca7848caced78e34e10a35","execution_authorization":{"git_blob_oid":"0b83a74642a89440cf7df22c3eeb92ec180c8d5a","path":"evals/m4/authorization/m4.2/execution-authorization.json","raw_sha256":"dc73c9376bdd78cf7e0d355701c8c3fe6966c34db5a1203544b9d95ab88e719b"},"execution_control":{"git_blob_oid":"04ca77769553f50c0b74f50ab8f239950a2b9a6d","path":"evals/m4/authorization/m4.2/execution-control.json","raw_sha256":"c482386a03895fb3820a8fd5b87f52cbd9ae80c5daeb64483dbfd7ea11c62b56"},"token_fingerprint":"sha256:38722c9e4b69...","token_status_after_claim":"CONSUMED","token_status_before_claim":"UNCONSUMED"},"batch_order":["M4.2-BATCH-NUC","M4.2-BATCH-MEC","M4.2-BATCH-ELE","M4.2-BATCH-AUT","M4.2-BATCH-COM","M4.2-BATCH-MPH"],"batches":[{"batch_id":"M4.2-BATCH-NUC","planned_task_count":10,"sequence":1,"task_ids":["M4.2-NUC-A-F","M4.2-NUC-B-A1","M4.2-NUC-A-A1","M4.2-NUC-B-A3","M4.2-NUC-A-A2","M4.2-NUC-B-F","M4.2-NUC-A-N","M4.2-NUC-B-A2","M4.2-NUC-A-A3","M4.2-NUC-B-N"]},{"batch_id":"M4.2-BATCH-MEC","planned_task_count":10,"sequence":2,"task_ids":["M4.2-MEC-A-N","M4.2-MEC-A-A1","M4.2-MEC-B-F","M4.2-MEC-A-A3","M4.2-MEC-B-A3","M4.2-MEC-B-A1","M4.2-MEC-B-A2","M4.2-MEC-A-A2","M4.2-MEC-A-F","M4.2-MEC-B-N"]},{"batch_id":"M4.2-BATCH-ELE","planned_task_count":10,"sequence":3,"task_ids":["M4.2-ELE-B-A2","M4.2-ELE-B-A1","M4.2-ELE-A-A1","M4.2-ELE-A-N","M4.2-ELE-A-F","M4.2-ELE-B-A3","M4.2-ELE-B-N","M4.2-ELE-B-F","M4.2-ELE-A-A3","M4.2-ELE-A-A2"]},{"batch_id":"M4.2-BATCH-AUT","planned_task_count":10,"sequence":4,"task_ids":["M4.2-AUT-B-A2","M4.2-AUT-B-A3","M4.2-AUT-A-A3","M4.2-AUT-B-A1","M4.2-AUT-A-A1","M4.2-AUT-B-N","M4.2-AUT-A-A2","M4.2-AUT-B-F","M4.2-AUT-A-N","M4.2-AUT-A-F"]},{"batch_id":"M4.2-BATCH-COM","planned_task_count":10,"sequence":5,"task_ids":["M4.2-COM-B-F","M4.2-COM-B-A1","M4.2-COM-B-A2","M4.2-COM-A-N","M4.2-COM-B-N","M4.2-COM-A-A3","M4.2-COM-B-A3","M4.2-COM-A-A2","M4.2-COM-A-F","M4.2-COM-A-A1"]},{"batch_id":"M4.2-BATCH-MPH","planned_task_count":10,"sequence":6,"task_ids":["M4.2-MPH-B-F","M4.2-MPH-A-N","M4.2-MPH-A-A2","M4.2-MPH-A-A1","M4.2-MPH-A-A3","M4.2-MPH-B-A2","M4.2-MPH-A-F","M4.2-MPH-B-N","M4.2-MPH-B-A1","M4.2-MPH-B-A3"]}],"claim_count":1,"claim_id":"a5827070-eb51-597b-ad26-5cf19fc51929","claimed_at_utc":"2026-08-13T09:07:51Z","configured_defaults":{"configured_default_check":"MATCHED","create_thread_model_field":"OMITTED","create_thread_thinking_field":"OMITTED","exact_model_id":"gpt-5.6-sol","reasoning_effort":"max"},"creation_semantics":{"mechanism":"python_os_open_O_CREAT_O_EXCL","overwrite_allowed":false,"target_path":"evals/m4/execution/m4.2/launch-claim.json","target_preexisted":false},"gate_a_acceptance":{"candidate_head":"9869aa4b22b5097619ce18b896a1c2b6e631e58b","candidate_tree":"b652942e38e81716e16065c4b32d4bb059326012","decision":"APPROVE_M4_2_ATOMIC_WHOLE_MATRIX_CLAIM_AND_EXECUTION_ONLY","pr_conclusion":"success","pr_run_id":31683144534,"push_conclusion":"success","push_run_id":31683141775},"limits":{"aggregation_calls":0,"attempts_per_task_id":1,"blind_map_reads":0,"cross_task_result_reads":0,"followups":0,"judge_calls":0,"repairs":0,"retries":0},"milestone":"M4","permissions_still_closed":["second claim","partial-matrix claim","retry","repair","follow-up message","cross-task result read","cross-arm result read","blind-map access","unblinding","judge execution","aggregation","threshold decision","M4 closure","M5"],"project":{"environment":"worktree","is_git_repository":true,"project_id":"ff35b25f-4644-41c8-9073-74c697559439","starting_branch":"codex/m4-cross-engineering-forward-evaluation-m4.2-one-shot-authorization","starting_head":"88410ce0ee640645aa44e1ba1289789532fd647a"},"request_binding_aggregate":{"algorithm":"sha256-canonical-json-task-request-bindings-v1","ordered_pair_count":60,"sha256":"30b473995e51d4b232e3f54d050e7485e6762761d95d87e08a14685c5bb7ce8b"},"revision":"M4.2","schema_version":"m4.2-launch-claim-v1","status":"CLAIMED","task_claims":[{"batch_id":"M4.2-BATCH-NUC","batch_sequence":1,"blind_id":"M4-J124","context_id":"0ba1a8d1-d69b-557f-9ea3-dac27264783e","dispatch_sequence":1,"finalization_id":"457d1275-f25b-5d19-b043-1f5ac25c2f57","request_binding_sha256":"b05f0b338f176a505647a0391770598b60e6070cfae113aeaa6b85c953f28165","result_root":"evals/m4/results/m4.2/M4.2-NUC-A-F","task_id":"M4.2-NUC-A-F","task_sequence_in_batch":1},{"batch_id":"M4.2-BATCH-NUC","batch_sequence":1,"blind_id":"M4-J125","context_id":"c3a5f9a6-a2ad-59a8-9b5c-1f9738b8256e","dispatch_sequence":2,"finalization_id":"430621b4-1fe0-5a7e-8e14-4d19e05242f2","request_binding_sha256":"2e799141d38dc3cd5146158486ba08b7158427d91ef664efdadd72bc99afc1f0","result_root":"evals/m4/results/m4.2/M4.2-NUC-B-A1","task_id":"M4.2-NUC-B-A1","task_sequence_in_batch":2},{"batch_id":"M4.2-BATCH-NUC","batch_sequence":1,"blind_id":"M4-J131","context_id":"096825fa-c68d-5db2-8ef7-cb8ba6eecd22","dispatch_sequence":3,"finalization_id":"1ef37d6e-dc5a-524f-9379-0fffb5610e2e","request_binding_sha256":"54b3d960cea67c0d264fe29be07ee43c2908082e574debce1c8fc1719bf35372","result_root":"evals/m4/results/m4.2/M4.2-NUC-A-A1","task_id":"M4.2-NUC-A-A1","task_sequence_in_batch":3},{"batch_id":"M4.2-BATCH-NUC","batch_sequence":1,"blind_id":"M4-J141","context_id":"e5c8daab-111c-5b3c-9a24-c7b21bcfa33d","dispatch_sequence":4,"finalization_id":"de044004-6410-5fad-95f2-73cf2de59adc","request_binding_sha256":"85d0489bc315d927d6578dac2f03926cc2961a8ce2b5338f7ac6f05d720112f8","result_root":"evals/m4/results/m4.2/M4.2-NUC-B-A3","task_id":"M4.2-NUC-B-A3","task_sequence_in_batch":4},{"batch_id":"M4.2-BATCH-NUC","batch_sequence":1,"blind_id":"M4-J147","context_id":"61bff68e-e959-5efb-abe8-4689c182f8e8","dispatch_sequence":5,"finalization_id":"323fc046-01f9-5aa5-9eb5-adba75cfdca0","request_binding_sha256":"c4577f49bac59ceaf035654db11f8c095426d275bf611d990b9a4be9715d6798","result_root":"evals/m4/results/m4.2/M4.2-NUC-A-A2","task_id":"M4.2-NUC-A-A2","task_sequence_in_batch":5},{"batch_id":"M4.2-BATCH-NUC","batch_sequence":1,"blind_id":"M4-J154","context_id":"8580a6e0-1199-58ba-8627-faeda2b54c81","dispatch_sequence":6,"finalization_id":"9b8df450-47d8-57a3-9254-91af6344ade2","request_binding_sha256":"162ebf3f5ebda76bd049d1c727128f206d42550d9bda3f45075b24a2fb81cafb","result_root":"evals/m4/results/m4.2/M4.2-NUC-B-F","task_id":"M4.2-NUC-B-F","task_sequence_in_batch":6},{"batch_id":"M4.2-BATCH-NUC","batch_sequence":1,"blind_id":"M4-J157","context_id":"779f12e7-43f2-5b3d-b445-34ada5bd6623","dispatch_sequence":7,"finalization_id":"9f2c2256-1790-5805-8eed-2b2218c124a1","request_binding_sha256":"f070896f489ef35342f6fc9aa8d1d863dc15a846158aa4b0f58f3a46551a52a1","result_root":"evals/m4/results/m4.2/M4.2-NUC-A-N","task_id":"M4.2-NUC-A-N","task_sequence_in_batch":7},{"batch_id":"M4.2-BATCH-NUC","batch_sequence":1,"blind_id":"M4-J164","context_id":"02b1064c-0b6f-5912-8406-113c029b5ad1","dispatch_sequence":8,"finalization_id":"e078bada-5f63-553d-8a4a-077daf10807d","request_binding_sha256":"0f5ccd8e47a457318b47c2e59da4ebe3a2a32f75695c8bf48c895e52a3775cfc","result_root":"evals/m4/results/m4.2/M4.2-NUC-B-A2","task_id":"M4.2-NUC-B-A2","task_sequence_in_batch":8},{"batch_id":"M4.2-BATCH-NUC","batch_sequence":1,"blind_id":"M4-J165","context_id":"e31de9cd-2983-5503-a787-4ab82144ceda","dispatch_sequence":9,"finalization_id":"f766abee-454a-528f-ab82-27c3ba8f9168","request_binding_sha256":"ef209cf1a65d84f9b4d77ecf57a78fba4417b79b660e0e643b64a6e18dc272c5","result_root":"evals/m4/results/m4.2/M4.2-NUC-A-A3","task_id":"M4.2-NUC-A-A3","task_sequence_in_batch":9},{"batch_id":"M4.2-BATCH-NUC","batch_sequence":1,"blind_id":"M4-J180","context_id":"2c566410-cab2-5f6c-95e9-8bd4a8a1222b","dispatch_sequence":10,"finalization_id":"27516e7f-baca-5b65-b4f0-e1729a2545d3","request_binding_sha256":"7f2f892e566fc8d6652e953edb678bd29f42611c61f59cf2edfd38ae4adeaed6","result_root":"evals/m4/results/m4.2/M4.2-NUC-B-N","task_id":"M4.2-NUC-B-N","task_sequence_in_batch":10},{"batch_id":"M4.2-BATCH-MEC","batch_sequence":2,"blind_id":"M4-J123","context_id":"1f9cca0c-19d1-5153-8fc9-d9c989f8957f","dispatch_sequence":11,"finalization_id":"99f21aee-d496-5c13-840d-aff12651a19b","request_binding_sha256":"551a9096414c9722b77b3e0bef3bf54253ae95114146740d781fde6683d204fa","result_root":"evals/m4/results/m4.2/M4.2-MEC-A-N","task_id":"M4.2-MEC-A-N","task_sequence_in_batch":1},{"batch_id":"M4.2-BATCH-MEC","batch_sequence":2,"blind_id":"M4-J127","context_id":"2486f1ee-d275-513e-be52-e4eff50e296c","dispatch_sequence":12,"finalization_id":"f44347ca-800f-58a6-a914-c397fd486baa","request_binding_sha256":"c6936cd323fe1f3cd222ca39ea75964b49d455ff126d735e5427dcc7c06e962c","result_root":"evals/m4/results/m4.2/M4.2-MEC-A-A1","task_id":"M4.2-MEC-A-A1","task_sequence_in_batch":2},{"batch_id":"M4.2-BATCH-MEC","batch_sequence":2,"blind_id":"M4-J129","context_id":"2c6ab807-ec4f-5757-bb0e-a9a4152d7d51","dispatch_sequence":13,"finalization_id":"dcfcb692-6720-5119-9c69-e4fd48a4508f","request_binding_sha256":"b848a4914fbf7754bf8d86de28217ec0031a9f05c40f72482b457273b7c2be94","result_root":"evals/m4/results/m4.2/M4.2-MEC-B-F","task_id":"M4.2-MEC-B-F","task_sequence_in_batch":3},{"batch_id":"M4.2-BATCH-MEC","batch_sequence":2,"blind_id":"M4-J135","context_id":"bb162bd7-9921-53c2-998f-c89c0c1fc06a","dispatch_sequence":14,"finalization_id":"3b027ff1-2059-55eb-9bc1-83b43c65336b","request_binding_sha256":"ee17bfcc0b6c0d2d614e983315e6e9a206b40de99e1d94d9957026174ba6f796","result_root":"evals/m4/results/m4.2/M4.2-MEC-A-A3","task_id":"M4.2-MEC-A-A3","task_sequence_in_batch":4},{"batch_id":"M4.2-BATCH-MEC","batch_sequence":2,"blind_id":"M4-J137","context_id":"72f01e8b-feed-5cf9-885e-527062876f61","dispatch_sequence":15,"finalization_id":"7ade5d19-441b-57b0-82c8-9c13fe6c60bb","request_binding_sha256":"aaaf59e48112edf2b5c9bd56048b06649962dc4fe5f